{
  "schemaVersion": 1,
  "cycleId": "cyc_01jbq3x8n5r7t9v2w4y6z8a0c1",
  "owner": "scottlz0310",
  "repo": "mcp-resource-subscriber",
  "prNumber": 226,
  "expectedHeadSha": "0123456789abcdef0123456789abcdef01234567",
  "round": 1,
  "dispatch": {
    "state": "failed",
    "candidateId": null,
    "attempts": 8,
    "errorCode": "UNAVAILABLE"
  },
  "cancellation": {
    "state": "requested",
    "cancelId": "cxl_01jbq3x8n5r7t9v2w4y6z8a0e1",
    "requestedAt": "2026-10-24T13:01:00Z",
    "confirmedAt": null,
    "errorCode": null
  },
  "execution": {
    "state": "unknown",
    "holdReason": null,
    "producerId": null,
    "producerEpoch": null,
    "sequence": null,
    "observedAt": null,
    "receivedAt": null,
    "freshness": "unknown",
    "outcome": null,
    "exitCode": null
  },
  "result": null,
  "terminal": false,
  "terminalReason": null,
  "supersededBy": null,
  "snapshotRevision": 4,
  "updatedAt": "2026-10-24T13:00:00Z"
}
