{
  "schemaVersion": 1,
  "cycleId": "cyc_01jbq3x8n5r7t9v2w4y6z8a0c1",
  "owner": "scottlz0310",
  "repo": "mcp-resource-subscriber",
  "prNumber": 226,
  "expectedHeadSha": "0123456789abcdef0123456789abcdef01234567",
  "round": 1,
  "dispatch": {
    "state": "pending",
    "candidateId": null,
    "attempts": 0,
    "errorCode": null
  },
  "cancellation": {
    "state": "none",
    "cancelId": null,
    "requestedAt": null,
    "confirmedAt": null,
    "errorCode": null
  },
  "execution": {
    "state": "unknown",
    "holdReason": null,
    "producerId": null,
    "producerEpoch": null,
    "sequence": null,
    "observedAt": null,
    "receivedAt": null,
    "freshness": "unknown",
    "outcome": null,
    "exitCode": null
  },
  "result": null,
  "terminal": true,
  "terminalReason": "superseded",
  "supersededBy": "cyc_01jbq3x8n5r7t9v2w4y6z8a0c2",
  "snapshotRevision": 2,
  "updatedAt": "2026-10-24T13:00:00Z"
}
